{
  "project": {
    "name": "calculator_app",
    "description": "Simple calculator mobile application with basic arithmetic operations and calculation history. Demonstrates Clean Architecture with Flutter and Riverpod state management.",
    "creation_date": "2024-11-01",
    "last_updated": "2024-11-14"
  },
  "platform_info": {
    "language": "Dart",
    "language_version": ">=3.3.2 <4.0.0",
    "framework": "Flutter",
    "framework_version": "3.29.0",
    "build_system": "Flutter SDK with Gradle (Android), Xcode (iOS)"
  },
  "technical_details": {
    "is_modular_project": false,
    "modules": [],
    "architecture_identified": [
      {
        "layer": "presentation",
        "pattern": "MVVM with Riverpod",
        "common_technologies": [
          "flutter_riverpod (State Management)",
          "StateNotifierProvider",
          "ConsumerWidget",
          "Material Design Components"
        ]
      },
      {
        "layer": "domain",
        "pattern": "Business Logic Layer",
        "common_technologies": [
          "Use Cases",
          "Domain Models",
          "Business Rules"
        ]
      },
      {
        "layer": "data",
        "pattern": "Repository Pattern",
        "common_technologies": [
          "Local Storage (SharedPreferences)",
          "History Repository",
          "Data Models"
        ]
      }
    ]
  },
  "features": [
    "Basic arithmetic operations (add, subtract, multiply, divide)",
    "Decimal number support",
    "Calculation history",
    "Clear and reset functions",
    "Responsive UI for different screen sizes"
  ]
}
